{
  "schema_version": "0.4.0",
  "document_type": "water_asset_extension",
  "document_status": "concept_extension_for_review",
  "generated_at": "2026-08-07T00:00:00Z",
  "extends": "homestead.primary.v0_3",
  "merge_target": "data/homestead_asset_register.yaml",
  "site_id": "site.site.primary.01",
  "source_document": "Homestead_Digital_Twin_Software_Design_Document_v0.3.md",
  "work_queue_item": "49.5",
  "control_narrative": "docs/water-control-narrative.md",
  "purpose": "The v0.3 asset register contains no water assets. This extension models the SDD section 3.4 water systems using the asset and relationship record shape of the base register so that merging it is a list concatenation. Every asset is status concept: nothing here has been sited, sized, specified or procured.",
  "merge_rules": [
    "Asset records use the identical field set and ordering as data/homestead_asset_register.yaml.",
    "Relationship IDs start at rel.1001 so they cannot collide with the base register's rel.0001-rel.0099.",
    "Parent and relationship endpoints may reference base-register assets; the reverse is not true until merge.",
    "Asset classes are used only where data/asset_class_dictionary.yaml already defines them. No class was invented."
  ],
  "asset_class_gaps": [
    {
      "needed_for": "Rainwater catchment surface (roof or other collection area)",
      "missing_class": "catchment_surface",
      "workaround": "The collection subsystem is modelled by its diverter, screen, inflow meter and cisterns only."
    },
    {
      "needed_for": "Pipe or line segments for routing, freeze exposure and leak localisation",
      "missing_class": "pipe_segment",
      "workaround": "Line identity is carried in each valve's served_line property; there is no routable pipe graph."
    },
    {
      "needed_for": "Distribution manifold or header as a physical object",
      "missing_class": "manifold",
      "workaround": "Modelled as the irrigation main valve plus its downstream zone valves."
    },
    {
      "needed_for": "Freeze-protection heat-trace circuit",
      "missing_class": "heat_trace_circuit",
      "workaround": "Heat trace is an electrical load; it belongs in the energy domain as an energy.load asset and in the load schedule, not in this water extension."
    },
    {
      "needed_for": "A generic non-well water source such as a spring, surface intake or delivered water",
      "missing_class": "water_source",
      "workaround": "Only the well class exists; rainwater is represented by its storage and inflow metering."
    }
  ],
  "design_basis": {
    "authoritative_design_document": "Homestead_Digital_Twin_Software_Design_Document_v0.3.md",
    "design_stage": "concept_only_no_water_infrastructure_exists",
    "requirements_covered": [
      "FR-200",
      "FR-201",
      "FR-202",
      "FR-203",
      "FR-204",
      "FR-205"
    ],
    "unresolved": [
      "Property location, terrain, aquifer and climate, which govern every water decision.",
      "Well depth, static level, drawdown behaviour and sustainable yield.",
      "Roof and catchment areas, rainfall record and therefore cistern sizing.",
      "Raw-water chemistry, and therefore the required treatment train.",
      "Pipe routing, burial depth, frost depth and line slope for winter drainage.",
      "Household and irrigation demand, and therefore the emergency potable reserve volume.",
      "Graywater reuse permissions in the final jurisdiction."
    ]
  },
  "asset_class_usage": {
    "controller": 3,
    "filter": 5,
    "flow_meter": 5,
    "graywater_branch": 1,
    "irrigation_zone": 2,
    "pressure_sensor": 3,
    "pump": 5,
    "safety_sensor": 2,
    "sensor": 3,
    "tank": 6,
    "treatment_stage": 2,
    "valve": 9,
    "well": 1
  },
  "assets": [
    {
      "asset_id": "water.well.site.01",
      "domain": "water",
      "asset_class": "well",
      "name": "Homestead Water Well",
      "status": "concept",
      "criticality": "critical",
      "control_authority": "none",
      "functional_position": true,
      "parent_id": "site.site.primary.01",
      "location": {
        "structure_or_zone": "TBD",
        "coordinates_status": "TBD"
      },
      "properties": {
        "depth_status": "TBD",
        "pump_association_status": "water.pump.well.01",
        "static_level_status": "TBD",
        "sustainable_yield_status": "TBD",
        "casing_status": "TBD",
        "water_quality_baseline_status": "TBD"
      },
      "external_identifiers": [],
      "network": {},
      "power": {},
      "dependencies": [],
      "manual_override": {},
      "documentation": [],
      "maintenance_plan": {},
      "point_profile_refs": [
        "common_monitored"
      ],
      "source_refs": [
        {
          "document": "Homestead_Digital_Twin_Software_Design_Document_v0.3.md",
          "section": "3.4, 12.3, 27.3"
        },
        {
          "document": "docs/water-control-narrative.md",
          "section": "Water control narrative v0.4"
        }
      ],
      "notes": [
        "No well exists and none has been drilled. Depth, yield and water chemistry are unknown and must come from a driller's log and a laboratory analysis, not from this document."
      ],
      "open_fields": [
        "well_depth_m",
        "static_water_level_m",
        "drawdown_behaviour",
        "sustainable_yield_lpm",
        "casing_diameter_and_material",
        "wellhead_location",
        "baseline_water_quality_analysis",
        "regulatory_permit_status"
      ],
      "tags": [
        "water_source",
        "potable_chain"
      ]
    },
    {
      "asset_id": "water.pump.well.01",
      "domain": "water",
      "asset_class": "pump",
      "name": "Well Pump",
      "status": "concept",
      "criticality": "critical",
      "control_authority": "local_controller_with_supervisory_setpoints",
      "functional_position": true,
      "parent_id": "water.well.site.01",
      "location": {
        "structure_or_zone": "TBD",
        "coordinates_status": "TBD"
      },
      "properties": {
        "motor_rating_status": "TBD",
        "source_asset_id": "water.well.site.01",
        "destination_asset_id": "water.tank.potable.storage_01",
        "pump_type_status": "TBD_submersible_or_jet",
        "curve_status": "TBD",
        "variable_speed_status": "TBD",
        "interlocks": [
          "dry_run",
          "low_source_level",
          "freeze_lockout",
          "overcurrent",
          "unavailable_discharge_path"
        ]
      },
      "external_identifiers": [],
      "network": {},
      "power": {},
      "dependencies": [],
      "manual_override": {},
      "documentation": [],
      "maintenance_plan": {},
      "point_profile_refs": [
        "common_commandable"
      ],
      "source_refs": [
        {
          "document": "Homestead_Digital_Twin_Software_Design_Document_v0.3.md",
          "section": "3.4, 12.3, 27.3"
        },
        {
          "document": "docs/water-control-narrative.md",
          "section": "Water control narrative v0.4"
        }
      ],
      "notes": [
        "FR-203 interlocks are listed as a requirement, not as commissioned values. Every threshold is a commissioning parameter set during the water commissioning cases.",
        "Electrical demand belongs to energy.load.site.water_pumping_01, which already exists in the register."
      ],
      "open_fields": [
        "motor_rated_kw",
        "pump_curve",
        "setting_depth_m",
        "variable_speed_or_fixed",
        "minimum_source_level_threshold",
        "overcurrent_threshold",
        "minimum_off_time_s",
        "branch_circuit"
      ],
      "tags": [
        "pump",
        "potable_chain",
        "fr_203"
      ]
    },
    {
      "asset_id": "water.sensor.well.level_01",
      "domain": "water",
      "asset_class": "sensor",
      "name": "Well Water-Level Sensor",
      "status": "concept",
      "criticality": "critical",
      "control_authority": "none",
      "functional_position": true,
      "parent_id": "water.well.site.01",
      "location": {
        "structure_or_zone": "TBD",
        "coordinates_status": "TBD"
      },
      "properties": {
        "sensor_type": "submersible_level_or_pressure_transducer",
        "range_status": "TBD",
        "calibration_status": "TBD"
      },
      "external_identifiers": [],
      "network": {},
      "power": {},
      "dependencies": [],
      "manual_override": {},
      "documentation": [],
      "maintenance_plan": {},
      "point_profile_refs": [
        "common_monitored"
      ],
      "source_refs": [
        {
          "document": "Homestead_Digital_Twin_Software_Design_Document_v0.3.md",
          "section": "3.4, 12.3, 27.3"
        },
        {
          "document": "docs/water-control-narrative.md",
          "section": "Water control narrative v0.4"
        }
      ],
      "notes": [
        "Provides the low-source-level permissive that FR-203 requires for the well pump."
      ],
      "open_fields": [
        "sensor_technology",
        "measurement_range",
        "installation_depth",
        "calibration_method"
      ],
      "tags": [
        "instrument",
        "fr_203"
      ]
    },
    {
      "asset_id": "water.flow_meter.well.01",
      "domain": "water",
      "asset_class": "flow_meter",
      "name": "Well Discharge Flow Meter",
      "status": "concept",
      "criticality": "important",
      "control_authority": "none",
      "functional_position": true,
      "parent_id": "water.well.site.01",
      "location": {
        "structure_or_zone": "TBD",
        "coordinates_status": "TBD"
      },
      "properties": {
        "pipe_size_status": "TBD",
        "direction": "source_to_storage",
        "meter_technology_status": "TBD"
      },
      "external_identifiers": [],
      "network": {},
      "power": {},
      "dependencies": [],
      "manual_override": {},
      "documentation": [],